answer,clue 1,clue 2,clue 3,clue 4,clue 5
SCOPE LENS,Power item for The Holder By One Stage,The Holder By One Stage-only held item,The Holder By One Stage Critical Hit Ratio boost item,,
SCORBUNNY,Rabbit Pokemon,Gen VIII Fire species,Ground egg-group species,,
SCORCHED SLAB,Hoenn city,Hoenn landmark,Urban landmark,City in Hoenn,
SCOVILLAIN,Spicy Pepper Pokemon,Mega form turns Grass/Fire,Gen IX Grass/Fire species,Evolves from Capsakid,Plant egg-group species
SCRAFTY,Hoodlum Pokemon,Mega form turns Dark/Fighting,Gen V Dark/Fighting species,Evolves from Scraggy,Ground egg-group species
SCRAGGY,Shedding Pokemon,Gen V Dark/Fighting species,Ground egg-group species,,
SCRAPPY,Gen IV ability,,,,
SCRATCH,Normal physical move,Gen I Normal move,40-power move,,
SCREAM TAIL,Paradox Pokemon,No-Eggs egg-group species,,,
SCREECH,Normal status move,Gen I Normal move,debuffing move,,
SCREEN CLEANER,Galarian Mr's signature Ability,Gen VIII ability,,,
SCUFIB CHAMBER,Ancient regional ruins,Kanto landmark,,,
SCYTHER,Mantis Pokemon,Gen I Bug/Flying species,Bug egg-group species,,
SEABREAK PATH,Sinnoh route,Sinnoh landmark,Route in Sinnoh,,
SEADRA,Dragon Pokemon,Gen I Water species,Evolves from Horsea,Water1 egg-group species,
SEAFOLK,Island location,Alola village,Ancient regional ruins,Alola landmark,Village in Alola
SEAGRASS HAVEN,Hisui island,Island in Hisui,Regional island,Island location,
SEA INCENSE,The Holder'S Water-Type Moves By Power boost item,Boosts Water moves for The Holder',Water-move booster,Signature orb for The Holder',Species-specific power orb
SEAKING,Goldfish Pokemon,Gen I Water species,Evolves from Goldeen,Water2 egg-group species,
SEAL BAG,Bug-Catching Contest ball,Event-only distribution item,Half-HP recovery berry,National Park contest ball,Pinch-healing berry
SEAL CASE,Adventure utility item,Progress-gating key item,Special Poke Ball,Unlocks progression content,
SEALED CHAMBER,Hoenn town,Hoenn landmark,Town-side landmark,Town in Hoenn,
SEALEO,Ball Roll Pokemon,Gen III Ice/Water species,Evolves from Spheal,Water1 egg-group species,
SEA MAUVILLE,Hides the Scanner,Partly reached by Dive,Site on Route 108,Dive-only landmark,Hoenn route
SEARING SHOT,Fire special move,burning move,Gen V Fire move,100-power move,
SEASIDE CAVE,Site on Route 21,Unova cavern,Cavern in Unova,Regional cavern,Bay-side landmark
SEASIDE HOLLOW,Hisui cave,Hisui landmark,Cave in Hisui,,
SEA SPIRITS DEN,Kalos landmark,,,,
SEAWARD CAVE,Island location,Bay-side landmark,Alola landmark,,
SECLUDED SHORE,Island location,Site on Route 12,Alola route,Route in Alola,Alola landmark
SECRET BASE,Hoenn landmark,,,,
SECRET ISLET,Hoenn route,Hoenn landmark,Route in Hoenn,,
SECRET KEY,Mythic event item,Unlocks progression content,,,
SECRET MEADOW,Hoenn landmark,Hoenn meadow,Regional meadow,,
SECRET POTION,Story-progress key item,Plot-critical key,,,
SECRET POWER,Normal physical move,Gen III Normal move,,,
SECRET SHORE,Hoenn route,Hoenn landmark,Route in Hoenn,,
SECRET SWORD,Fighting special move,Gen V Fighting move,85-power move,,
SEED BOMB,Grass physical move,Gen IV Grass move,80-power move,,
SEED FLARE,Grass special move,Gen IV Grass move,120-power move,debuffing move,
SEEDOT,Acorn Pokemon,Gen III Grass species,Ground egg-group species,,
SEED SOWER,Arboliva's signature Ability,Gen IX ability,,,
SEEL,Sea Lion Pokemon,Gen I Water species,Water1 egg-group species,,
SEISMIC TOSS,Fighting physical move,Gen I Fighting move,,,
SEISMITOAD,Vibration Pokemon,Gen V Water/Ground species,Evolves from Palpitoad,Water1 egg-group species,
SELF DESTRUCT,Normal physical move,Gen I Normal move,200-power move,,
SENDOFF SPRING,Sinnoh cave,Sinnoh landmark,Cave in Sinnoh,,
SENTRET,Scout Pokemon,Gen II Normal species,Ground egg-group species,,
SEQUENCE,Gen V ability,,,,
SERENE GRACE,Status-blocking trait,Prevents major status ailments,Ailment-proof trait,Weather-linked trait,
SERPERIOR,Regal Pokemon,Gen V Grass species,Evolves from Servine,Ground egg-group species,
SERVINE,Grass Snake Pokemon,Gen V Grass species,Evolves from Snivy,Ground egg-group species,
SEVAULT CANYON,Island location,Kanto route,Ancient regional ruins,Kanto landmark,Route in Kanto
SEVEN ISLAND,Kanto town,Ancient regional ruins,Kanto landmark,Town-side landmark,Town in Kanto
SEVIPER,Fang Snake Pokemon,Gen III Poison species,Ground egg-group species,,
SEWADDLE,Sewing Pokemon,Gen V Bug/Grass species,Bug egg-group species,,
SHACKLE,core-series ability,,,,
SHADOW,combat type,battle element,,,
SHADOW BALL,Ghost special move,Gen II Ghost move,80-power move,debuffing move,
SHADOW BLAST,critical-hit move,80-power move,,,
SHADOW BLITZ,40-power move,Shadow physical move,,,
SHADOW BOLT,paralyzing move,75-power move,,,
SHADOW BONE,Ghost physical move,Gen VII Ghost move,85-power move,debuffing move,
SHADOW BREAK,75-power move,Shadow physical move,,,
SHADOW CHILL,75-power move,Shadow special move,,,
SHADOW CLAW,Ghost physical move,critical-hit move,Gen IV Ghost move,70-power move,
SHADOW DASH,Gen V ability,,,,
SHADOW DOWN,debuffing move,Shadow status move,,,
SHADOW END,120-power move,Shadow physical move,,,
SHADOW FIRE,burning move,75-power move,,,
SHADOW FORCE,Ghost physical move,Gen IV Ghost move,120-power move,protective move,
SHADOW MIST,debuffing move,Shadow status move,,,
SHADOW PUNCH,Ghost physical move,Gen III Ghost move,60-power move,,
SHADOW RAVE,70-power move,Shadow special move,,,
SHADOW RUSH,critical-hit move,55-power move,,,
SHADOW SHIELD,Lunala's signature Ability,Gen VII ability,,,
SHADOW SNEAK,Ghost physical move,Gen IV Ghost move,40-power move,priority move,
SHADOW STORM,95-power move,Shadow special move,,,
SHADOW TAG,Wynaut And Wobbuffet's signature Ability,Prevents escape,Traps opposing Pokemon,No-escape battle trait,switching trait
SHADOW WAVE,50-power move,Shadow special move,,,
SHADY HOUSE,Island location,Alola town,Alola landmark,Town-side landmark,Town in Alola
SHALOUR,Town-side landmark,Urban landmark,,,
SHALOUR GATE,Kalos route connector,Kalos landmark,Connector gate in Kalos,,
SHALOUR SABLE,Cures all major status conditions,Full status remedy,Also cures confusion,,
SHARE,Gen V ability,,,,
SHARP BEAK,The Holder'S Flying-Type Moves By Power boost item,Boosts Flying moves for The Holder',Flying-move booster,Signature orb for The Holder',Species-specific power orb
SHARPEDO,Brutal Pokemon,Mega form turns Water/Dark,Gen III Water/Dark species,Evolves from Carvanha,Water2 egg-group species
SHARPEDONITE,Sharpedo Mega stone,Mega Evolution stone,Held stone for Sharpedo,Mega trigger stone,
SHARPEN,Normal status move,Gen I Normal move,boosting move,,
SHARPNESS,Gen IX ability,poisoning ability,,,
SHAYMIN,Mythical Pokemon,Gen IV Gratitude Pokemon,No-Eggs egg-group species,,
SHEDINJA,Shed Pokemon,Gen III Bug/Ghost species,Mineral egg-group species,,
SHED SHELL,Bug-Catching Contest ball,Boosts recovery from draining moves,National Park contest ball,Drain-healing boost item,Increases Ingrain and Aqua Ring recovery
SHED SKIN,burning ability,healing ability,Gen III ability,,
SHED TAIL,Normal status move,Gen IX Normal move,0-power move,protective move,switching move
SHEER COLD,Ice special move,Gen III Ice move,,,
SHEER FORCE,Status-blocking trait,Prevents major status ailments,Ailment-proof trait,Weather-linked trait,
SHELGON,Endurance Pokemon,Gen III Dragon species,Evolves from Bagon,Dragon egg-group species,
SHELL ARMOR,Blocks critical hits,Critical-hit proof trait,protective trait,,
SHELL BELL,Pinch-healing berry,Half-HP recovery berry,Tradable exchange item,Exchangeable collectible,
SHELLDER,Bivalve Pokemon,Gen I Water species,Water3 egg-group species,,
SHELLOS,Sea Slug Pokemon,Gen IV Water species,Water1 egg-group species,,
SHELL SIDE ARM,Poison special move,Gen VIII Poison move,90-power move,poisoning move,
SHELL SMASH,Normal status move,Gen V Normal move,boosting move,debuffing move,
SHELL TRAP,Fire special move,Gen VII Fire move,150-power move,,
SHELMET,Snail Pokemon,Gen V Bug species,Bug egg-group species,,
SHELTER,Steel status move,Gen VIII Steel move,0-power move,boosting move,
SHIELD DUST,Status-blocking trait,Prevents major status ailments,Ailment-proof trait,protective trait,
SHIELDON,Shield Pokemon,Monster egg-group species,,,
SHIELDS DOWN,Minior's signature Ability,Status-blocking trait,Prevents major status ailments,Ailment-proof trait,
SHIFT GEAR,Steel status move,Gen V Steel move,boosting move,,
SHIFTRY,Wicked Pokemon,Gen III Grass/Dark species,Evolves from Nuzleaf,Ground egg-group species,
SHIINOTIC,Fairy Pokemon,Gen VII Illuminating Pokemon,Gen VII Grass/Fairy species,Evolves from Morelull,Plant egg-group species
SHINX,Flash Pokemon,Gen IV Electric species,Ground egg-group species,,
SHINY CHARM,Event-only distribution item,Unlocks progression content,Limited event key item,Progress-gating key item,Adventure utility item
SHINY STONE,Bug-Catching Contest ball,National Park contest ball,Held item for Florges Effect,Tradable exchange item,Exchangeable collectible
SHOAL CAVE,Site on Route 125,Hoenn city,Hoenn landmark,Urban landmark,City in Hoenn
SHOCK DRIVE,Species-linked power item,Signature battle item,,,
SHOCK WAVE,Electric special move,Gen III Electric move,60-power move,,
SHORE UP,Ground status move,Gen VII Ground move,,,
SHROODLE,Toxic Mouse Pokemon,Ground egg-group species,,,
SHROOMISH,Mushroom Pokemon,Gen III Grass species,Fairy egg-group species,,
SHROUDED RUINS,Crimson Mirelands area,Hisui landmark,,,
SHUCA BERRY,Tradable exchange item,Exchangeable collectible,PokBlock and Poffin berry,Berry-blending ingredient,
SHUCKLE,Mold Pokemon,Gen II Bug/Rock species,Bug egg-group species,,
SHUPPET,Puppet Pokemon,Gen III Ghost species,Indeterminate egg-group species,,
SIGILYPH,Avianoid Pokemon,Gen V Psychic/Flying species,Flying egg-group species,,
SIGNAL BEAM,Bug special move,Gen III Bug move,75-power move,,
SILCOON,Cocoon Pokemon,Gen III Bug species,Evolves from Wurmple,Bug egg-group species,
SILICOBRA,Sand Snake Pokemon,Gen VIII Ground species,Ground egg-group species,,
SILK SCARF,The Holder'S Normal-Type Moves By Power boost item,Boosts Normal moves for The Holder',Normal-move booster,Signature orb for The Holder',Species-specific power orb
SILK TRAP,Bug status move,Gen IX Bug move,0-power move,debuffing move,priority move
SILPH SCOPE,Unlocks progression content,Progress-gating key item,Story-progress key item,Plot-critical key,Special Poke Ball
SILVALLY,Legendary Pokemon,Gen VII Synthetic Pokemon,Evolves from Type,No-Eggs egg-group species,
SILVER LEAF,Event-only distribution item,Limited event key item,Valuable sellable loot,Vendor treasure,
SILVER POWDER,The Holder'S Bug-Type Moves By Power boost item,Boosts Bug moves for The Holder',Bug-move booster,Signature orb for The Holder',Species-specific power orb
SILVER WIND,Bug special move,Gen III Bug move,60-power move,boosting move,
SILVER WING,Story-progress key item,Plot-critical key,,,
SIMIPOUR,Geyser Pokemon,Gen V Water species,Evolves from Panpour,Ground egg-group species,
SIMISAGE,Thorn Monkey Pokemon,Gen V Grass species,Evolves from Pansage,Ground egg-group species,
SIMISEAR,Ember Pokemon,Gen V Fire species,Evolves from Pansear,Ground egg-group species,
SIMPLE,Copies an ally's stat changes,Numel's signature Ability,Inherits teammate stat boosts,Ally stat-copying trait,
SIMPLE BEAM,Normal status move,Gen V Normal move,,,
SING,Sleep-inducing move,Move that puts foes to sleep,Normal status move,Gen I Normal move,
SINISTCHA,Matcha Pokemon,Evolves from Poltchageist,Mineral egg-group species,,
SINISTEA,Black Tea Pokemon,Gen VIII Ghost species,Mineral egg-group species,,
SINJOH RUINS,Johto landmark,Ancient regional ruins,,,
SIRFETCHD,Wild Duck Pokemon,Gen VIII Fighting species,Evolves from Galarian,Flying egg-group species,
SITRUS BERRY,Bug-Catching Contest ball,National Park contest ball,Restores 30 HP,30-HP restorative,Tradable exchange item
SIX ISLAND,Kanto town,Kanto landmark,Town-side landmark,Town in Kanto,
SIZZLIPEDE,Radiator Pokemon,Gen VIII Fire/Bug species,Bug egg-group species,,
SIZZLY SLIDE,Fire physical move,Gen VII Fire move,60-power move,,
SKARMORY,Armor Bird Pokemon,Mega form turns Steel/Flying,Gen II Steel/Flying species,Flying egg-group species,
SKATER,Gen V ability,,,,
SKELEDIRGE,Singer Pokemon,Gen IX Fire/Ghost species,Evolves from Crocalor,Ground egg-group species,
SKETCH,Normal status move,Gen II Normal move,,,
SKIDDO,Mount Pokemon,Gen VI Grass species,Ground egg-group species,,
SKILL LINK,Shellder And Cloyster's signature Ability,Gen IV ability,,,
SKILL SWAP,Psychic status move,Gen III Psychic move,,,
SKIPLOOM,Cottonweed Pokemon,Gen II Grass/Flying species,Evolves from Hoppip,Fairy egg-group species,
SKITTER SMACK,Bug physical move,Gen VIII Bug move,70-power move,,
SKITTY,Kitten Pokemon,Gen III Normal species,Ground egg-group species,,
SKORUPI,Scorpion Pokemon,Gen IV Poison/Bug species,Bug egg-group species,,
SKRELP,Mock Kelp Pokemon,Gen VI Poison/Water species,Water1 egg-group species,,
SKULL BASH,Normal physical move,Gen I Normal move,130-power move,boosting move,
SKULL FOSSIL,Revives into Cranidos,Gen IV relic for Cranidos,Prehistoric revival item,,
SKUNTANK,Skunk Pokemon,Gen IV Poison/Dark species,Evolves from Stunky,Ground egg-group species,
SKWOVET,Cheeky Pokemon,Gen VIII Normal species,Ground egg-group species,,
SKY ATTACK,Flying physical move,Gen I Flying move,140-power move,flinch-causing move,
SKY DROP,Flying physical move,Gen V Flying move,60-power move,,
SKY PILLAR,Route 131 tower,Island location,Hoenn town,Hoenn landmark,Town-side landmark
SKY PLATE,The Holder'S Flying-Type Moves By Power boost item,Boosts Flying moves for The Holder',Flying-move booster,Signature orb for The Holder',Species-specific power orb
SKY UPPERCUT,Fighting physical move,Gen III Fighting move,85-power move,,
SLACK OFF,Normal status move,Gen III Normal move,,,
SLAKING,Lazy Pokemon,Gen III Normal species,Evolves from Vigoroth,Ground egg-group species,
SLAKOTH,Slacker Pokemon,Gen III Normal species,Ground egg-group species,,
SLAM,Normal physical move,Gen I Normal move,80-power move,,
SLASH,Normal physical move,critical-hit move,Gen I Normal move,70-power move,
SLATEPORT,Beach house landmark,Hoenn town,Hoenn landmark,Town-side landmark,Urban landmark
SLEEP POWDER,Grass status move,Gen I Grass move,,,
SLEEP TALK,Normal status move,Gen II Normal move,,,
SLIGGOO,Soft Tissue Pokemon,Gen VI Dragon species,Evolves from Goomy,Dragon egg-group species,
SLIPPERY SLOPE,Galar landmark,Galar slope,,,
SLITHER WING,Paradox Pokemon,No-Eggs egg-group species,,,
SLOWBRO,Hermit Crab Pokemon,Mega form turns Water/Psychic,Gen I Water/Psychic species,Evolves from Slowpoke,Monster egg-group species
SLOWBRONITE,Slowbro Mega stone,Mega Evolution stone,Held stone for Slowbro,Held Mega stone,Mega trigger stone
SLOWKING,Royal Pokemon,Gen II Water/Psychic species,Evolves from Slowpoke,Monster egg-group species,
SLOWPOKE,Dopey Pokemon,Gen I Water/Psychic species,Monster egg-group species,,
SLOWPOKE TAIL,Gen VI unused,Berry-blending ingredient,unused,,
SLOWPOKE WELL,Site on Route 33,Johto town,Johto landmark,Town-side landmark,Town in Johto
SLOW START,Regigigas's signature Ability,Gen IV ability,switching ability,,
SLUDGE,Poison special move,Gen I Poison move,65-power move,poisoning move,
SLUDGE BOMB,Poison special move,Gen II Poison move,90-power move,poisoning move,
SLUDGE MOUND,Crimson Mirelands area,Hisui landmark,,,
SLUDGE WAVE,Poison special move,Gen V Poison move,95-power move,poisoning move,
SLUGMA,Lava Pokemon,Gen II Fire species,Indeterminate egg-group species,,
SLURPUFF,Meringue Pokemon,Gen VI Fairy species,Evolves from Swirlix,Fairy egg-group species,
SLUSH RUSH,Weather-linked trait,,,,
SMACK DOWN,Rock physical move,Gen V Rock move,50-power move,,
SMALL BOUQUET,Valuable sellable loot,Vendor treasure,,,
SMART STRIKE,Steel physical move,Gen VII Steel move,70-power move,,
SMEARGLE,Painter Pokemon,Gen II Normal species,Ground egg-group species,,
SMELLING SALTS,Normal physical move,paralyzing move,Gen III Normal move,70-power move,
SMOG,Poison special move,Gen I Poison move,30-power move,poisoning move,
SMOKE BALL,Held battle item,,,,
SMOKESCREEN,Normal status move,Gen I Normal move,debuffing move,,
SMOLIV,Olive Pokemon,Gen IX Grass/Normal species,Plant egg-group species,,
SMOOCHUM,Kiss Pokemon,No-Eggs egg-group species,,,
SMOOTH ROCK,Extends the,The lengthener,,,
SNAP TRAP,Grass physical move,Gen VIII Grass move,35-power move,,
SNARL,Dark special move,Gen V Dark move,55-power move,debuffing move,
SNATCH,Dark status move,Gen III Dark move,priority move,,
SNEASEL,Sharp Claw Pokemon,Gen II Dark/Ice species,Ground egg-group species,,
SNEASLER,Free Climb Pokemon,Evolves from Hisuian,Ground egg-group species,,
SNIPER,critical-hit trait,,,,
SNIPE SHOT,Water special move,Gen VIII Water move,80-power move,,
SNIVY,Grass Snake Pokemon,Gen V Grass species,Ground egg-group species,,
SNOM,Worm Pokemon,Gen VIII Worm Pokemon,Gen VIII Ice/Bug species,Bug egg-group species,
SNORE,Normal special move,Gen II Normal move,50-power move,flinch-causing move,
SNORLAX,Sleeping Pokemon,Gen I Normal species,Evolves from Munchlax,Monster egg-group species,
SNORUNT,Snow Hat Pokemon,Gen III Ice species,Fairy egg-group species,,
SNOVER,Frost Tree Pokemon,Gen IV Grass/Ice species,Monster egg-group species,,
SNOWBALL,Boosts Attack after hit with an ice-type attack,Attack boost on trigger,Special Poke Ball,,
SNOWBELLE,Kalos city,Kalos landmark,Urban landmark,City in Kalos,
SNOWBELLE GATE,Kalos route connector,Kalos landmark,Connector gate in Kalos,,
SNOW CLOAK,Weather-linked trait,protective trait,,,
SNOWPOINT,Sinnoh city,Sinnoh landmark,Urban landmark,City in Sinnoh,
SNOWSCAPE,Ice status move,Gen IX Ice move,0-power move,boosting move,healing move
SNOW WARNING,Snover And Abomasnow's signature Ability,Weather-linked trait,,,
SNUBBULL,Fairy Pokemon,Gen II Fairy species,Ground egg-group species,,
SOAK,Water status move,Gen V Water move,,,
SOBBLE,Water Lizard Pokemon,Gen VIII Water species,Water1 egg-group species,,
SOCARRAT TRAIL,Paldea forest,Paldea landmark,Forest in Paldea,,
SODA POP,Safari Zone catcher,Pinch-healing berry,Great Marsh capture tool,Restores 60 HP,Half-HP recovery berry
SOFT BOILED,Normal status move,Gen I Normal move,,,
SOFT SAND,The Holder'S Ground-Type Moves By Power boost item,Boosts Ground moves for The Holder',Ground-move booster,Signature orb for The Holder',Species-specific power orb
SOLACEON,Site on Route 209,Sinnoh town,Ancient regional ruins,Sinnoh landmark,Town-side landmark
SOLACEON RUINS,Crimson Mirelands area,Sinnoh town,Sinnoh landmark,Town-side landmark,Town in Sinnoh
SOLAR BEAM,Grass special move,Gen I Grass move,120-power move,,
SOLAR BLADE,Grass physical move,Gen VII Grass move,125-power move,,
SOLAR POWER,Weather-linked trait,,,,
SOLGALEO,Legendary Pokemon,Gen VII Sunne Pokemon,Evolves from Cosmoem,No-Eggs egg-group species,
SOLID ROCK,Gen IV ability,,,,
SOLOSIS,Cell Pokemon,Gen V Psychic species,Indeterminate egg-group species,,
SOLROCK,Meteorite Pokemon,Gen III Rock/Psychic species,Mineral egg-group species,,
SONIAS BOOK,Story-progress key item,Plot-critical key,,,
SONIC BOOM,Always deals 20 damage,Normal special move,Gen I Normal move,,
SONOROUS PATH,Hisui landmark,Located in The Southern Region Of The Coronet Highlands Of Hisui,,,
SOOTHE BELL,Special Poke Ball,Held battle item,,,
SOOTOPOLIS,Hoenn city,Hoenn landmark,Urban landmark,City in Hoenn,
SOOT SACK,Unlocks progression content,Progress-gating key item,Adventure utility item,,
SOUL DEW,Boosts Psychic/Dragon moves for Latios Or Latias,Power item for Psychic- And Dragon-Type Moves,Psychic- And Dragon-Type Moves-only held item,Signature orb for Latios Or Latias,Species-specific power orb
SOUL HEART,Magearna's signature Ability,boosting trait,,,
SOUNDPROOF,Damages sleeping foes,Nightmare-causing trait,Sleep-punishing trait,Status-blocking trait,Prevents major status ailments
SPACE WORLD,regional map location,Gen IV location,,,
SPACIAL REND,Dragon special move,critical-hit move,Gen IV Dragon move,100-power move,
SPARK,Electric physical move,paralyzing move,Gen II Electric move,65-power move,
SPARKLING ARIA,Water special move,burning move,Gen VII Water move,90-power move,
SPARKLY SWIRL,Fairy special move,Gen VII Fairy move,120-power move,,
SPEAROW,Tiny Bird Pokemon,Gen I Normal/Flying species,Flying egg-group species,,
SPEAR PILLAR,Ancient regional ruins,Sinnoh landmark,,,
SPECTRAL THIEF,Ghost physical move,Gen VII Ghost move,90-power move,,
SPECTRIER,Legendary Pokemon,Gen VIII Swift Horse Pokemon,No-Eggs egg-group species,,
SPEED BOOST,boosting trait,,,,
SPEED SWAP,Psychic status move,Gen VII Psychic move,,,
SPELL TAG,The Holder'S Ghost-Type Moves By Power boost item,Boosts Ghost moves for The Holder',Ghost-move booster,Signature orb for The Holder',Species-specific power orb
SPELON BERRY,Tradable exchange item,Exchangeable collectible,PokBlock and Poffin berry,Berry-blending ingredient,Loamy-soil berry crop
SPEWPA,Scatterdust Pokemon,Gen VI Bug species,Evolves from Scatterbug,Bug egg-group species,
SPHEAL,Clap Pokemon,Gen III Ice/Water species,Water1 egg-group species,,
SPICY EXTRACT,Grass status move,Stat-lowering move,Gen IX Grass move,0-power move,boosting move
SPIDER WEB,Prevents foes from leaving battle,Bug status move,Gen II Bug move,,
SPIDOPS,Trap Pokemon,Gen IX Bug species,Evolves from Tarountula,Bug egg-group species,
SPIKE CANNON,Normal physical move,Gen I Normal move,20-power move,,
SPIKEMUTH,Site on Route 9,Galar town,Galar landmark,Town-side landmark,Town in Galar
SPIKES,Ground status move,Gen II Ground move,switching move,,
SPIKES PASSAGE,Kalos mountain pass,Kalos pass,Pass in Kalos,Regional pass,Kalos landmark
SPIKY SHIELD,Grass status move,Gen VI Grass move,priority move,,
SPINARAK,String Spit Pokemon,Gen II Bug/Poison species,Bug egg-group species,,
SPINDA,Spot Panda Pokemon,Gen III Normal species,Ground egg-group species,,
SPIN OUT,Steel physical move,Gen IX Steel move,100-power move,debuffing move,
SPIRIT BREAK,Fairy physical move,Gen VIII Fairy move,75-power move,debuffing move,
SPIRITOMB,Forbidden Pokemon,Gen IV Ghost/Dark species,Indeterminate egg-group species,,
SPIRIT SHACKLE,Ghost physical move,Gen VII Ghost move,80-power move,,
SPITE,Ghost status move,Gen II Ghost move,debuffing move,,
SPIT UP,Normal special move,Gen III Normal move,,,
SPLASH,Normal status move,Gen I Normal move,,,
SPLASH PLATE,The Holder'S Water-Type Moves By Power boost item,Boosts Water moves for The Holder',Water-move booster,Signature orb for The Holder',Species-specific power orb
SPLISHY SPLASH,Water special move,Gen VII Water move,90-power move,,
SPOINK,Bounce Pokemon,Gen III Psychic species,Ground egg-group species,,
SPONGE,Gen V ability,,,,
SPOOKY PLATE,The Holder'S Ghost-Type Moves By Power boost item,Boosts Ghost moves for The Holder',Ghost-move booster,Signature orb for The Holder',Species-specific power orb
SPORT BALL,Bug-Catching Contest ball,National Park contest ball,Special Poke Ball,,
SPOTLIGHT,Normal status move,Gen VII Normal move,priority move,,
SPRAYDUCK,Unlocks progression content,Progress-gating key item,Adventure utility item,,
SPRIGATITO,Grass Cat Pokemon,Gen IX Grass species,Ground egg-group species,,
SPRING PATH,Sinnoh cave,Sinnoh landmark,Cave in Sinnoh,,
SPRINKLOTAD,Unlocks progression content,Progress-gating key item,Adventure utility item,,
SPRINT,Gen V ability,,,,
SPRITZEE,Perfume Pokemon,Gen VI Fairy species,Fairy egg-group species,,
SPROUT TOWER,Johto city,Johto landmark,Urban landmark,City in Johto,
SQUAWKABILLY,Parrot Pokemon,Gen IX Normal/Flying species,Flying egg-group species,,
SQUIRT BOTTLE,Unlocks progression content,Progress-gating key item,Story-progress key item,Plot-critical key,
SQUIRTLE,Tiny Turtle Pokemon,Gen I Water species,Monster egg-group species,,
SS ANNE,Kanto landmark,,,,
SS AQUA,Johto landmark,,,,
SS TICKET,Story or event key item,Story-progress key item,Plot-critical key,Unlocking key item,
SS TICKET HOENN,Story or event key item,Unlocking key item,,,
SS TIDAL,Hoenn landmark,,,,
STAKATAKA,Rampart Pokemon,No-Eggs egg-group species,,,
STAKEOUT,Yungoos And Gumshoos's signature Ability,switching trait,,,
STALL,Sableye's signature Ability,priority trait,,,
STALWART,Duraludon And Archaludon's signature Ability,Gen VIII ability,draining ability,switching ability,
STAMINA,Mudbray And Mudsdale's signature Ability,boosting trait,,,
STANCE CHANGE,Aegislash's signature Ability,Status-blocking trait,Prevents major status ailments,Ailment-proof trait,switching trait
STANTLER,Big Horn Pokemon,Gen II Normal species,Ground egg-group species,,
STARAPTOR,Leaves its flock behind,Gray-Brown bird of prey,Lives apart from its flock,Mega form turns Fighting/Flying,Large-foe challenger
STARAVIA,Starling Pokemon,Gen IV Normal/Flying species,Evolves from Starly,Flying egg-group species,
STARDUST,Valuable sellable loot,Vendor treasure,,,
STARF BERRY,Its Stats In A Pinch One boost item,Power item for Its Stats In A Pinch,Poor on most other targets,PokBlock and Poffin berry,Berry-blending ingredient
STARK MOUNTAIN,Site on Route 227,Sinnoh cave,Sinnoh landmark,Cave in Sinnoh,
STARLY,Starling Pokemon,Gen IV Normal/Flying species,Flying egg-group species,,
STARMIE,Mysterious Pokemon,Mega form turns Water/Psychic,Gen I Water/Psychic species,Evolves from Staryu,Water3 egg-group species
STAR PIECE,Tradable exchange item,Exchangeable collectible,Valuable sellable loot,Vendor treasure,
STAR SWEET,Milcery evolution item,Requires a spin while held,Spin-to-evolve held item,Evolution-trigger item,
STARYU,Star Shape Pokemon,Gen I Water species,Water3 egg-group species,,
