answer,clue 1,clue 2,clue 3,clue 4,clue 5
LOST ITEM,Unlocks progression content,Plot-critical key,Progress-gating key item,Story-progress key item,
LOST TOWER,Sinnoh town,Sinnoh landmark,Town-side landmark,Town in Sinnoh,
LOTAD,Water Weed Pokemon,Gen III Water/Grass species,Water1 egg-group species,,
LOUDRED,Big Voice Pokemon,Gen III Normal species,Evolves from Whismur,Monster egg-group species,
LOVE BALL,Poor on most other targets,Special Poke Ball,,,
LOVELY KISS,Sleep-inducing move,Move that puts foes to sleep,Normal status move,Gen I Normal move,
LOVELY PLACE,regional map location,Gen IV location,,,
LOVE SWEET,Milcery evolution item,Requires a spin while held,Spin-to-evolve held item,Evolution-trigger item,
LOW KICK,Stronger against heavier targets,Can reach 120 power on heavy foes,Fighting physical move,Gen I Fighting move,
LOW SWEEP,Fighting physical move,Gen V Fighting move,65-power move,debuffing move,
LOYALTY PLAZA,Paldea town,Paldea landmark,Town-side landmark,Town in Paldea,
LUCARIO,Aura Pokemon,Gen IV Fighting/Steel species,Evolves from Riolu,Ground egg-group species,
LUCARIONITE,Lucario Mega stone,Mega Evolution stone,Held stone for Lucario,Held Mega stone,Mega trigger stone
LUCK INCENSE,Doubles prize money,Battle-payout doubler,Money-boosting held item,,
LUCKY CHANT,Normal status move,critical-hit move,Gen IV Normal move,,
LUCKY EGG,Held battle item,,,,
LUCKY PUNCH,Critical-hit booster,Critical Hit Ratio Of A Chansey-only held item,Raises crit odds in battle,Power item for Critical Hit Ratio Of A Chansey,Critical Hit Ratio Of A Chansey Critical Hit Ratio boost item
LUDICOLO,Carefree Pokemon,Gen III Water/Grass species,Evolves from Lombre,Water1 egg-group species,
LUGIA,Legendary Pokemon,Gen II Diving Pokemon,No-Eggs egg-group species,,
LULLABY,Gen V ability,,,,
LUM BERRY,Tradable exchange item,Exchangeable collectible,PokBlock and Poffin berry,Berry-blending ingredient,
LUMINA CRASH,Psychic special move,Stat-lowering move,Gen IX Psychic move,80-power move,debuffing move
LUMINEON,Neon Pokemon,Gen IV Water species,Evolves from Finneon,Water2 egg-group species,
LUMINOUS MOSS,Special Defense boost on trigger,Boosts Special Defense after hit with a water-type attack,,,
LUMIOSE,Urban landmark,,,,
LUMIOSE GATE,Kalos route connector,Kalos landmark,Connector gate in Kalos,,
LUNALA,Legendary Pokemon,Gen VII Moone Pokemon,Purple Moone Pokemon,Evolves from Cosmoem,No-Eggs egg-group species
LUNAR BLESSING,Psychic status move,Gen VIII Psychic move,0-power move,healing move,
LUNAR DANCE,Psychic status move,Gen IV Psychic move,,,
LUNAR WING,Event-only key item,Mythic event item,,,
LUNATONE,Meteorite Pokemon,Gen III Rock/Psychic species,Mineral egg-group species,,
LUNCHBOX,Gen V ability,,,,
LUNGE,Bug physical move,Gen VII Bug move,80-power move,debuffing move,
LUNKERS LAIR,Hisui landmark,,,,
LURANTIS,Bloom Sickle Pokemon,Gen VII Grass species,Evolves from Fomantis,Plant egg-group species,
LURE BALL,Poor on most other targets,Special Poke Ball,,,
LUSH JUNGLE,Site on Route 5,Island location,Alola route,Alola landmark,Route in Alola
LUSTER PURGE,Psychic special move,Gen III Psychic move,95-power move,debuffing move,
LUSTROUS GLOBE,Unlocks progression content,Progress-gating key item,Adventure utility item,,
LUSTROUS ORB,Dragon- And Water-Type Moves Power boost item,Boosts Dragon/Water moves for Palkia,,,
LUVDISC,Rendezvous Pokemon,Gen III Water species,Water2 egg-group species,,
LUXIO,Spark Pokemon,Gen IV Electric species,Evolves from Shinx,Ground egg-group species,
LUXRAY,Gleam Eyes Pokemon,Gen IV Electric species,Evolves from Luxio,Ground egg-group species,
LUXURY BALL,Poor on most other targets,Special Poke Ball,,,
LYCANROC,Wolf Pokemon,Gen VII Rock species,Evolves from Rockruff,Ground egg-group species,
LYSANDRE LABS,Kalos city,Kalos landmark,Urban landmark,City in Kalos,
MABOSSTIFF,Boss Pokemon,Gen IX Dark species,Evolves from Maschiff,Ground egg-group species,
MACHAMP,Superpower Pokemon,Gen I Fighting species,Evolves from Machoke,Humanshape egg-group species,
MACH BIKE,Unlocks progression content,Two-wheeled travel item,Progress-gating key item,Ride for quick travel,Adventure utility item
MACHINE PART,Story-progress key item,Plot-critical key,,,
MACHO BRACE,The Pokemon Holding This Item Is Halved During Battle-only held item,Held battle item,,,
MACHOKE,Superpower Pokemon,Gen I Fighting species,Evolves from Machop,Humanshape egg-group species,
MACHOP,Superpower Pokemon,Gen I Fighting species,Humanshape egg-group species,,
MACH PUNCH,Fighting physical move,Gen II Fighting move,40-power move,priority move,
MAGBY,Live Coal Pokemon,No-Eggs egg-group species,,,
MAGCARGO,Lava Pokemon,Gen II Fire/Rock species,Evolves from Slugma,Indeterminate egg-group species,
MAGEARNA,Mythical Pokemon,Gen VII Artificial Pokemon,Mega-evolving species,No-Eggs egg-group species,
MAGICAL LEAF,Grass special move,Gen III Grass move,60-power move,,
MAGICAL TORQUE,Copies the foe's last move,Fairy physical move,Gen IX Fairy move,100-power move,
MAGIC BOUNCE,debuffing ability,protective ability,switching ability,Gen V ability,
MAGIC COAT,Psychic status move,Gen III Psychic move,priority move,,
MAGIC GUARD,Prevents Explosion and Self-Destruct,Clefairy'S Evolutionary Line's signature Ability,Stops self-destructing moves,Explosion-blocking trait,Status-blocking trait
MAGICIAN,Punishes contact attackers,Damages foes on contact KO,Contact-backlash trait,,
MAGIC POWDER,Psychic status move,Gen VIII Psychic move,,,
MAGIC ROOM,Psychic status move,Gen V Psychic move,,,
MAGIKARP,Fish Pokemon,Gen I Water species,Water2 egg-group species,,
MAGMA ARMOR,burning ability,protective ability,switching ability,Gen III ability,
MAGMA EMBLEM,Unlocks progression content,Progress-gating key item,Story-progress key item,Plot-critical key,
MAGMA HIDEOUT,Located in Lilycove In Pokemon Ruby And Omega Ruby,Hoenn landmark,,,
MAGMAR,Spitfire Pokemon,Gen I Fire species,Evolves from Magby,Humanshape egg-group species,
MAGMARIZER,Magmar evolution item,Evolution-trigger item,Evolves Magmar into Magmortar When Traded While Holding It,,
MAGMA STONE,Unlocks progression content,Progress-gating key item,Story-progress key item,Plot-critical key,
MAGMA STORM,Fire special move,Gen IV Fire move,100-power move,,
MAGMA SUIT,Unlocks progression content,Progress-gating key item,Story-progress key item,Plot-critical key,
MAGMORTAR,Blast Pokemon,Gen IV Fire species,Evolves from Magmar,Humanshape egg-group species,
MAGNEMITE,Magnet Pokemon,Gen I Electric/Steel species,Mineral egg-group species,,
MAGNET,The Holder'S Electric-Type Moves By Power boost item,Boosts Electric moves for The Holder',Electric-move booster,Signature orb for The Holder',Species-specific power orb
MAGNET BOMB,Steel physical move,Gen IV Steel move,60-power move,,
MAGNETIC FLUX,Electric status move,Gen VI Electric move,boosting move,,
MAGNETON,Paradox Pokemon,Gen I Magnet Pokemon,Gen I Electric/Steel species,Evolves from Magnemite,Mineral egg-group species
MAGNET PULL,Prevents escape,Traps opposing Pokemon,No-escape battle trait,switching trait,
MAGNET RISE,Electric status move,Gen IV Electric move,,,
MAGNEZONE,Magnet Area Pokemon,Gen IV Electric/Steel species,Evolves from Magneton,Mineral egg-group species,
MAGNITUDE,Ground physical move,Gen II Ground move,,,
MAGO BERRY,Tradable exchange item,Exchangeable collectible,PokBlock and Poffin berry,Pinch-healing berry,Half-HP recovery berry
MAGOST BERRY,Tradable exchange item,Exchangeable collectible,PokBlock and Poffin berry,Berry-blending ingredient,Loamy-soil berry crop
MAHALO TRAIL,Alola town,Ancient regional ruins,Alola landmark,Town-side landmark,Urban landmark
MAHOGANY,Johto town,Johto landmark,Town-side landmark,Town in Johto,
MAKE IT RAIN,Steel special move,Gen IX Steel move,120-power move,debuffing move,
MAKEUP BAG,Trainer cosmetic case,Unlocks progression content,Progress-gating key item,Adventure utility item,
MAKUHITA,Guts Pokemon,Gen III Fighting species,Humanshape egg-group species,,
MALAMAR,Overturning Pokemon,Mega form turns Dark/Psychic,Gen VI Dark/Psychic species,Evolves from Inkay,Water1 egg-group species
MALIE,Island location,Alola city,Alola landmark,Urban landmark,City in Alola
MALIE GARDEN,Island location,Alola city,Alola landmark,Urban landmark,City in Alola
MAMOSWINE,Twin Tusk Pokemon,Gen IV Ice/Ground species,Evolves from Piloswine,Ground egg-group species,
MAMOSWINE ROAD,Kalos route,Town-side landmark,Urban landmark,Route in Kalos,Kalos landmark
MANAPHY,Mythical Pokemon,Gen IV Seafaring Pokemon,Water1 egg-group species,,
MANDIBUZZ,Bone Vulture Pokemon,Gen V Dark/Flying species,Evolves from Vullaby,Flying egg-group species,
MANECTITE,Manectric Mega stone,Mega Evolution stone,Held stone for Manectric,Held Mega stone,Mega trigger stone
MANECTRIC,Discharge Pokemon,Gen III Electric species,Evolves from Electrike,Mega-evolving species,Ground egg-group species
MANIAC TUNNEL,Ancient regional ruins,Sinnoh landmark,,,
MANKEY,Pig Monkey Pokemon,Gen I Fighting species,Ground egg-group species,,
MANTINE,Kite Pokemon,Gen II Water/Flying species,Evolves from Mantyke,Water1 egg-group species,
MANTYKE,Kite Pokemon,No-Eggs egg-group species,,,
MARACTUS,Cactus Pokemon,Gen V Grass species,Plant egg-group species,,
MARANGA BERRY,Poor on most other targets,Special Defense boost on trigger,Boosts Special Defense after hit by a special move,PokBlock-making berry,Berry-blending ingredient
MAREANIE,Brutal Star Pokemon,Gen VII Poison/Water species,Water1 egg-group species,,
MAREEP,Wool Pokemon,Gen II Electric species,Monster egg-group species,,
MARILL,Fairy Pokemon,Gen II Aqua Mouse Pokemon,Gen II Water/Fairy species,Evolves from Azurill,Water1 egg-group species
MARINE CAVE,Hoenn landmark,Hoenn cave,,,
MARINE TUBE,Unova town,Bay-side landmark,Unova landmark,Town in Unova,
MARK CHARM,Unlocks progression content,Progress-gating key item,Adventure utility item,,
MAROWAK,Bone Keeper Pokemon,Gen I Ground species,Evolves from Cubone,Monster egg-group species,
MARSHADOW,Mythical Pokemon,Gen VII Gloomdweller Pokemon,No-Eggs egg-group species,,
MARSHTOMP,Mud Fish Pokemon,Gen III Water/Ground species,Evolves from Mudkip,Monster egg-group species,
MARVEL SCALE,paralyzing ability,Milotic's signature Ability,Gen III ability,poisoning ability,
MASCHIFF,Rascal Pokemon,Gen IX Dark species,Ground egg-group species,,
MASQUERAIN,Eyeball Pokemon,Gen III Bug/Flying species,Evolves from Surskit,Water1 egg-group species,
MASTER BALL,Never-fails capture tool,Special Poke Ball,,,
MASTER DOJO,Galar landmark,,,,
MAT BLOCK,Fighting status move,Gen VI Fighting move,protective move,,
MATCHA GOTCHA,Grass special move,burning move,Gen IX Grass move,80-power move,healing move
MAUSHOLD,Family Pokemon,Gen IX Normal species,Evolves from Tandemaus,Ground egg-group species,
MAUVILLE,Hoenn city,Hoenn landmark,Urban landmark,City in Hoenn,
MAWILE,Fairy Pokemon,Gen III Deceiver Pokemon,Black Deceiver Pokemon,Mega form turns Steel/Fairy,Gen III Steel/Fairy species
MAWILITE,Mawile Mega stone,Mega Evolution stone,Held stone for Mawile,Mega trigger stone,
MAX AIRSTREAM,Flying physical move,Gen VIII Flying move,10-power move,,
MAX DARKNESS,Dark physical move,Gen VIII Dark move,10-power move,,
MAX ELIXIR,Event-only distribution item,Limited event key item,,,
MAX ETHER,Event-only distribution item,Limited event key item,,,
MAX FLARE,Fire physical move,Gen VIII Fire move,100-power move,,
MAX FLUTTERBY,Bug physical move,Gen VIII Bug move,10-power move,,
MAX GEYSER,Water physical move,Gen VIII Water move,10-power move,,
MAX GUARD,Normal status move,Gen VIII Normal move,priority move,,
MAX HAILSTORM,Ice physical move,Gen VIII Ice move,10-power move,,
MAX HONEY,Gen VIII revival,Berry-blending ingredient,revival,,
MAX KNUCKLE,Fighting physical move,Gen VIII Fighting move,10-power move,,
MAX LAIR,Galar landmark,,,,
MAX LIGHTNING,Electric physical move,Gen VIII Electric move,10-power move,,
MAX LURE,spelunking,,,,
MAX MINDSTORM,Psychic physical move,Gen VIII Psychic move,10-power move,,
MAX MUSHROOMS,Tradable exchange item,Exchangeable collectible,,,
MAX OOZE,Poison physical move,Gen VIII Poison move,10-power move,poisoning move,
MAX OVERGROWTH,Grass physical move,Gen VIII Grass move,10-power move,,
MAX PHANTASM,Ghost physical move,Gen VIII Ghost move,10-power move,,
MAX POTION,Safari Zone catcher,Pinch-healing berry,Great Marsh capture tool,Half-HP recovery berry,
MAX QUAKE,Ground physical move,Gen VIII Ground move,10-power move,,
MAX REPEL,Safari Zone catcher,Great Marsh capture tool,Event-only distribution item,Limited event key item,
MAX REVIVE,Safari Zone catcher,Great Marsh capture tool,Event-only distribution item,Limited event key item,
MAX ROCKFALL,Rock physical move,Gen VIII Rock move,10-power move,,
MAX STARFALL,Fairy physical move,Gen VIII Fairy move,10-power move,,
MAX STEELSPIKE,Steel physical move,Gen VIII Steel move,10-power move,,
MAX STRIKE,Normal physical move,Gen VIII Normal move,10-power move,,
MAX WYRMWIND,Dragon physical move,Gen VIII Dragon move,10-power move,,
MEADOW PLATE,The Holder'S Grass-Type Moves By Power boost item,Boosts Grass moves for The Holder',Grass-move booster,Signature orb for The Holder',Species-specific power orb
MEAN LOOK,Prevents foes from leaving battle,Normal status move,Gen II Normal move,,
MEDAL BOX,Unlocks progression content,Progress-gating key item,Adventure utility item,,
MEDALI,Paldea town,Paldea landmark,Town-side landmark,Town in Paldea,
MEDIC,Gen V ability,,,,
MEDICHAM,Meditate Pokemon,Mega form turns Fighting/Psychic,Gen III Fighting/Psychic species,Evolves from Meditite,Humanshape egg-group species
MEDICHAMITE,Medicham Mega stone,Mega Evolution stone,Held stone for Medicham,Held Mega stone,Mega trigger stone
MEDITATE,Psychic status move,Gen I Psychic move,boosting move,,
MEDITITE,Meditate Pokemon,Gen III Fighting/Psychic species,Humanshape egg-group species,,
ME FIRST,Normal status move,Gen IV Normal move,,,
MEGA ANCHOR,Progress-gating key item,Unlocks progression content,unused,,
MEGA ANKLET,Progress-gating key item,Unlocks progression content,unused,,
MEGA BRACELET,Unlocks progression content,Progress-gating key item,Adventure utility item,,
MEGA CHARM,Progress-gating key item,Unlocks progression content,unused,,
MEGA CUFF,Progress-gating key item,Unlocks progression content,unused,,
MEGA DRAIN,Self-healing move,Grass special move,Gen I Grass move,40-power move,draining move
MEGA GLASSES,Progress-gating key item,Unlocks progression content,unused,,
MEGA GLOVE,Progress-gating key item,Unlocks progression content,unused,,
MEGAHORN,Bug physical move,Gen II Bug move,120-power move,,
MEGA KICK,Normal physical move,Gen I Normal move,120-power move,,
MEGA LAUNCHER,Clauncher And Clawitzer's signature Ability,Status-blocking trait,Prevents major status ailments,Ailment-proof trait,
MEGANIUM,Herb Pokemon,Mega form turns Grass/Fairy,Gen II Grass species,Evolves from Bayleef,Monster egg-group species
MEGA PENDANT,Progress-gating key item,Unlocks progression content,unused,,
MEGA PUNCH,Normal physical move,Gen I Normal move,80-power move,,
MEGA RING,Unlocks progression content,Progress-gating key item,Adventure utility item,,
MEGA STICKPIN,Progress-gating key item,Unlocks progression content,unused,,
MEGA TIARA,Progress-gating key item,Unlocks progression content,unused,,
MELEE,Gen V ability,,,,
MELEMELE SEA,Site on Route 1,Island location,Alola city,Alola landmark,Urban landmark
MELMETAL,Mythical Pokemon,Gen VII Hex Nut Pokemon,Evolves from Meltan,No-Eggs egg-group species,
MELOETTA,Mythical Pokemon,Gen V Melody Pokemon,No-Eggs egg-group species,,
MELTAN,Mythical Pokemon,Gen VII Hex Nut Pokemon,No-Eggs egg-group species,,
MEMBER CARD,Unlocks progression content,Event-only key item,Progress-gating key item,Story or event key item,Mythic event item
MEMENTO,Dark status move,Gen III Dark move,debuffing move,,
MEMORIAL HILL,Site on Route 9,Island location,Alola route,Alola landmark,Route in Alola
MENHIR TRAIL,Kalos route,Town-side landmark,Urban landmark,Route in Kalos,Kalos landmark
MENTAL HERB,Held battle item,,,,
MEOWSCARADA,Magician Pokemon,Gen IX Grass/Dark species,Evolves from Floragato,Ground egg-group species,
MEOWSTIC,Constraint Pokemon,Gen VI Psychic species,Evolves from Espurr,Mega-evolving species,Ground egg-group species
MEOWTH,Scratch Cat Pokemon,Gen I Normal species,Ground egg-group species,,
MERCILESS,Mareanie And Toxapex's signature Ability,critical-hit trait,poisoning trait,,
MESAGOZA,Paldea city,Paldea landmark,Urban landmark,City in Paldea,
MESPRIT,Legendary Pokemon,Gen IV Emotion Pokemon,No-Eggs egg-group species,,
METAGROSS,legendary Pokemon,Gen III Iron Leg Pokemon,Mega form turns Steel/Psychic,Gen III Steel/Psychic species,Evolves from Metang
METAGROSSITE,Metagross Mega stone,Mega Evolution stone,Held stone for Metagross,Held Mega stone,Mega trigger stone
METAL BURST,Steel physical move,Gen IV Steel move,,,
METAL CLAW,Steel physical move,Gen II Steel move,50-power move,boosting move,
METAL COAT,Steel-move booster,Onix To Evolve Into Steelix And Scyther evolution item,Held item for Scizor When Traded While Holding It,,
METAL POWDER,Defense Stat Of A Ditto Defense boost item,Power item for Defense Stat Of A Ditto,Defense Stat Of A Ditto-only held item,,
METAL SOUND,Steel status move,Gen III Steel move,debuffing move,,
METANG,Iron Claw Pokemon,Gen III Steel/Psychic species,Evolves from Beldum,Mineral egg-group species,
METAPOD,Cocoon Pokemon,Gen I Bug species,Evolves from Caterpie,Bug egg-group species,
METEOR ASSAULT,Fighting physical move,Gen VIII Fighting move,150-power move,,
METEOR BEAM,Rock special move,Gen VIII Rock move,120-power move,,
METEOR FALLS,Hoenn town,Hoenn landmark,Town-side landmark,Town in Hoenn,
METEORITE,Unlocks progression content,Tradable exchange item,Progress-gating key item,Exchangeable collectible,Story-progress key item
METEOR MASH,Steel physical move,Gen III Steel move,90-power move,boosting move,
METRONOME,Normal status move,Gen I Normal move,,,
MEWTWO,Legendary Pokemon,Gen I Genetic Pokemon,No-Eggs egg-group species,,
MEWTWONITE X,Mewtwo X Mega stone,Mega Evolution stone,Held stone for Mewtwo X,Held Mega stone,Mega trigger stone
MEWTWONITE Y,Mewtwo Y Mega stone,Mega Evolution stone,Held stone for Mewtwo Y,Held Mega stone,Mega trigger stone
MICLE BERRY,Poor on most other targets,A Move Just Once In A Pinch-only held item,Power item for A Move Just Once In A Pinch,PokBlock and Poffin berry,Berry-blending ingredient
MIENFOO,Martial Arts Pokemon,Gen V Fighting species,Ground egg-group species,,
MIENSHAO,Martial Arts Pokemon,Gen V Fighting species,Evolves from Mienfoo,Ground egg-group species,
MIGHTY CLEAVE,Rock physical move,burning move,Gen IX Rock move,95-power move,protective move
MIGHTYENA,Bite Pokemon,Gen III Dark species,Evolves from Poochyena,Ground egg-group species,
MILCERY,Cream Pokemon,Gen VIII Fairy species,Fairy egg-group species,,
MILK DRINK,Normal status move,Gen II Normal move,,,
MILOTIC,Tender Pokemon,Gen III Water species,Evolves from Feebas,Water1 egg-group species,
MILTANK,Milk Cow Pokemon,Gen II Normal species,Ground egg-group species,,
MIME JR,No-Eggs egg-group species,"25 Attack, 60 Speed species",,,
MIMIC,Copies the foe's last move,Normal status move,Gen I Normal move,,
MIMICRY,Galarian Stunfisk's signature Ability,Gen VIII ability,switching ability,,
MIMIKYU,Fairy Pokemon,Gen VII Disguise Pokemon,Gen VII Ghost/Fairy species,Indeterminate egg-group species,
MINCCINO,Chinchilla Pokemon,Gen V Normal species,Ground egg-group species,,
MIND BLOWN,Fire special move,Gen VII Fire move,150-power move,,
MIND PLATE,The Holder'S Psychic-Type Moves By Power boost item,Boosts Psychic moves for The Holder',Psychic-move booster,Signature orb for The Holder',Species-specific power orb
MIND READER,Normal status move,Gen II Normal move,,,
MINDS EYE,debuffing trait,,,,
MINIMIZE,Normal status move,Gen I Normal move,boosting move,,
MINING MUSEUM,Sinnoh city,Sinnoh landmark,Urban landmark,City in Sinnoh,
MINIOR,Meteor Pokemon,Gen VII Rock/Flying species,Mineral egg-group species,,
MINUN,Cheering Pokemon,Gen III Electric species,Fairy egg-group species,,
MINUS,Minun's signature Ability,Gen III ability,boosting ability,,
MIRACLE EYE,Psychic status move,Gen IV Psychic move,,,
MIRACLE SEED,The Holder'S Grass-Type Moves By Power boost item,Boosts Grass moves for The Holder',Grass-move booster,Signature orb for The Holder',Species-specific power orb
MIRAGE CAVE,Island location,Hoenn landmark,Hoenn cave,,
MIRAGE FOREST,Hoenn landmark,Hoenn forest,,,
MIRAGE ISLAND,Hoenn landmark,Island in Hoenn,,,
MIRAGE TOWER,Hoenn route,Hoenn landmark,Route in Hoenn,,
MIRAIDON,Paradox Pokemon,No-Eggs egg-group species,,,
MIROIR WAY,Kalos landmark,Kalos route,Town-side landmark,Route in Kalos,
MIRROR ARMOR,Corviknight's signature Ability,debuffing trait,,,
MIRROR COAT,Psychic special move,Gen II Psychic move,,,
MIRROR HERB,Held battle item,,,,
MIRROR MOVE,Copies the foe's last move,Flying status move,Gen I Flying move,,
MIRROR SHOT,Steel special move,Gen IV Steel move,65-power move,debuffing move,
MISDREAVUS,Paradox Pokemon,Gen II Screech Pokemon,Gen II Ghost species,Indeterminate egg-group species,
MISMAGIUS,Magical Pokemon,Gen IV Ghost species,Evolves from Misdreavus,Indeterminate egg-group species,
MIST,Ice status move,Gen I Ice move,protective move,,
MIST BALL,Psychic special move,Gen III Psychic move,95-power move,debuffing move,
MISTRALTON,Unova city,Unova landmark,City in Unova,,
MISTY SEED,Held battle item,,,,
MISTY SURGE,Tapu Fini's signature Ability,Gen VII ability,,,
MISTY TERRAIN,Fairy status move,Gen VI Fairy move,protective move,,
MOLD BREAKER,debuffing ability,poisoning ability,switching ability,Gen IV ability,
MOLTEN ARENA,Hisui island,Island in Hisui,Regional island,Island location,
MOLTRES,Legendary Pokemon,Gen I Flame Pokemon,No-Eggs egg-group species,,
MONEAN CHAMBER,Ancient regional ruins,Kanto landmark,,,
MONFERNO,Playful Pokemon,Gen IV Fire/Fighting species,Evolves from Chimchar,Ground egg-group species,
MONTENEVERA,Paldea town,Paldea landmark,Town-side landmark,Town in Paldea,
MOOD MAKER,Gen V ability,,,,
MOODY,boosting trait,debuffing trait,,,
MOOMOO MILK,Pinch-healing berry,Restores 100 HP,Half-HP recovery berry,100-HP restorative,Berry-blending ingredient
MOON BALL,Poor on most other targets,Special Poke Ball,,,
MOONBLAST,Fairy special move,Gen VI Fairy move,95-power move,debuffing move,
MOON FLUTE,Evolves Nebby into Solgaleo,Nebby evolution item,Held item for Solgaleo,Unlocks progression content,Progress-gating key item
MOONGEIST BEAM,Ghost special move,Gen VII Ghost move,100-power move,,
MOONLIGHT,Fairy status move,Gen II Fairy move,,,
MOON STONE,Bug-Catching Contest ball,National Park contest ball,Held item for Musharna Effect,Tradable exchange item,Exchangeable collectible
MOONVIEW ARENA,Hisui cave,Hisui landmark,Cave in Hisui,,
MOOR OF ICIRRUS,Unova landmark,,,,
MORELULL,Fairy Pokemon,Gen VII Illuminating Pokemon,Gen VII Grass/Fairy species,Plant egg-group species,
MORGREM,Fairy Pokemon,Gen VIII Devious Pokemon,Gen VIII Dark/Fairy species,Evolves from Impidimp,Fairy egg-group species
MORNING SUN,Normal status move,Gen II Normal move,,,
MORPEKO,Two-Sided Pokemon,Gen VIII Electric/Dark species,Ground egg-group species,,
MORTAL SPIN,Poison physical move,Gen IX Poison move,30-power move,poisoning move,
MOSSDEEP,Island location,Hoenn city,Hoenn landmark,Urban landmark,City in Hoenn
MOSSUI,Paldea town,Paldea landmark,Town-side landmark,Town in Paldea,
MOTHIM,Moth Pokemon,Gen IV Bug/Flying species,Evolves from A,Bug egg-group species,
MOTOR DRIVE,Electivire's signature Ability,Gen IV ability,boosting ability,protective ability,
MOTOSTOKE,Galar city,Galar landmark,Urban landmark,City in Galar,
MOUNTAINEER,Gen V ability,,,,
MOUNTAIN GALE,Ice physical move,Gen VIII Ice move,100-power move,debuffing move,flinch-causing move
MOUNT HOKULANI,Island location,Alola route,Alola landmark,Route in Alola,
MOUNT LANAKILA,Island location,Alola village,Alola landmark,Village in Alola,
MOXIE,boosting trait,,,,
MR MIME,Fairy Pokemon,Gen I Barrier Pokemon,Gen I Psychic/Fairy species,Humanshape egg-group species,
MR POKEMON,Site on Route 30,,,,
MR RIME,Comedian Pokemon,Gen VIII Ice/Psychic species,Evolves from Galarian,Humanshape egg-group species,
MT CHIMNEY,Hoenn town,Hoenn landmark,Town-side landmark,Town in Hoenn,
MT CORONET,Sinnoh town,Town-side landmark,Town in Sinnoh,Sinnoh landmark,
MT EMBER,Kanto island,Island in Kanto,Regional island,Island location,
MT MOON,Kanto mountain,Regional mountain,Kanto landmark,Mountain in Kanto,
MT MORTAR,Johto city,Johto landmark,Urban landmark,City in Johto,
MT PYRE,Route 122 tower,Hoenn house,House in Hoenn,Regional house,Ancient regional ruins
MT SILVER,Johto town,Johto landmark,Town-side landmark,Town in Johto,
MT SILVER CAVE,Johto landmark,,,,
MUD BOMB,Ground special move,Gen IV Ground move,65-power move,debuffing move,
MUDBRAY,Donkey Pokemon,Gen VII Ground species,Ground egg-group species,,
MUDDY WATER,90-power move,debuffing move,,,
MUDKIP,Mud Fish Pokemon,Gen III Water species,Monster egg-group species,,
MUDSDALE,Draft Horse Pokemon,Gen VII Ground species,Evolves from Mudbray,Ground egg-group species,
MUD SHOT,Ground special move,Gen III Ground move,55-power move,debuffing move,
MUD SLAP,Ground special move,Gen II Ground move,20-power move,debuffing move,
MUD SPORT,Ground status move,Gen III Ground move,,,
MULTI ATTACK,Normal physical move,Gen VII Normal move,120-power move,,
MULTISCALE,Gen V ability,,,,
MULTITYPE,Arceus's signature Ability,Gen IV ability,switching ability,,
